{
  "$schema": "https://calavera.schalkneethling.com/schemas/calavera-artifact.schema.json",
  "schemaVersion": 1,
  "id": "skill-github-goal-issue-triage",
  "type": "skill",
  "displayName": "GitHub goal issue triage",
  "payload": "payload/github-goal-issue-triage",
  "compatibility": {
    "calavera": ">=2.2.0"
  }
}
